{
  "$schema": "https://json-schema.org/draft/2020-12/schema",
  "$id": "https://initforge.github.io/agent-rules/implementation-intent-receipt.schema.json",
  "title": "Pre-mutation Implementation Intent Receipt",
  "type": "object",
  "additionalProperties": false,
  "required": ["schema", "version", "planId", "planRevision", "taskId", "requirementIds", "claimIds", "goal", "ownedPaths", "forbiddenPaths", "expectedChange", "proofPlan", "understood", "receiptSha256"],
  "properties": {
    "schema": { "const": "harness/implementation-intent-receipt" },
    "version": { "const": 1 },
    "planId": { "type": "string", "minLength": 1 },
    "planRevision": { "type": "integer", "minimum": 1 },
    "taskId": { "type": "string", "minLength": 1 },
    "requirementIds": { "type": "array", "minItems": 1, "items": { "type": "string", "minLength": 1 } },
    "claimIds": { "type": "array", "minItems": 1, "items": { "type": "string", "minLength": 1 } },
    "goal": { "type": "string", "minLength": 1 },
    "ownedPaths": { "type": "array", "minItems": 1, "items": { "type": "string", "minLength": 1 } },
    "forbiddenPaths": { "type": "array", "items": { "type": "string", "minLength": 1 } },
    "expectedChange": { "type": "string", "minLength": 1 },
    "proofPlan": { "type": "array", "minItems": 1, "items": { "type": "string", "minLength": 1 } },
    "understood": { "const": true },
    "receiptSha256": { "type": "string", "pattern": "^[a-f0-9]{64}$" }
  }
}
